<?xml version="1.0" encoding="UTF-8"?>
<dataroot xmlns:od="urn:schemas-microsoft-com:officedata" xmlns:xsi="http://www.w3.org/2001/XMLSchema-instance" xsi:noNamespaceSchemaLocation="NIAN_HAO.xsd" generated="2013-11-25T16:42:20">
    <NIAN_HAO>
        <c_nianhao_id>0</c_nianhao_id>
        <c_dy>0</c_dy>
        <c_dynasty_chn>未詳</c_dynasty_chn>
        <c_nianhao_chn>未詳</c_nianhao_chn>
        <c_nianhao_pin>unknown</c_nianhao_pin>
    </NIAN_HAO>
    <NIAN_HAO>
        <c_nianhao_id>1</c_nianhao_id>
        <c_dy>29</c_dy>
        <c_dynasty_chn>西漢</c_dynasty_chn>
        <c_nianhao_chn>建元</c_nianhao_chn>
        <c_firstyear>-140</c_firstyear>
        <c_lastyear>-135</c_lastyear>
    </NIAN_HAO>
    <NIAN_HAO>
        <c_nianhao_id>2</c_nianhao_id>
        <c_dy>29</c_dy>
        <c_dynasty_chn>西漢</c_dynasty_chn>
        <c_nianhao_chn>元光</c_nianhao_chn>
        <c_firstyear>-134</c_firstyear>
        <c_lastyear>-129</c_lastyear>
    </NIAN_HAO>
    <NIAN_HAO>
        <c_nianhao_id>3</c_nianhao_id>
        <c_dy>29</c_dy>
        <c_dynasty_chn>西漢</c_dynasty_chn>
        <c_nianhao_chn>元朔</c_nianhao_chn>
        <c_firstyear>-128</c_firstyear>
        <c_lastyear>-123</c_lastyear>
    </NIAN_HAO>
    <NIAN_HAO>
        <c_nianhao_id>4</c_nianhao_id>
        <c_dy>29</c_dy>
        <c_dynasty_chn>西漢</c_dynasty_chn>
        <c_nianhao_chn>元狩</c_nianhao_chn>
        <c_firstyear>-122</c_firstyear>
        <c_lastyear>-117</c_lastyear>
    </NIAN_HAO>
    <NIAN_HAO>
        <c_nianhao_id>5</c_nianhao_id>
        <c_dy>29</c_dy>
        <c_dynasty_chn>西漢</c_dynasty_chn>
        <c_nianhao_chn>元鼎</c_nianhao_chn>
        <c_firstyear>-116</c_firstyear>
        <c_lastyear>-111</c_lastyear>
    </NIAN_HAO>
    <NIAN_HAO>
        <c_nianhao_id>6</c_nianhao_id>
        <c_dy>29</c_dy>
        <c_dynasty_chn>西漢</c_dynasty_chn>
        <c_nianhao_chn>元封</c_nianhao_chn>
        <c_firstyear>-110</c_firstyear>
        <c_lastyear>-105</c_lastyear>
    </NIAN_HAO>
    <NIAN_HAO>
        <c_nianhao_id>7</c_nianhao_id>
        <c_dy>29</c_dy>
        <c_dynasty_chn>西漢</c_dynasty_chn>
        <c_nianhao_chn>太初</c_nianhao_chn>
        <c_firstyear>-104</c_firstyear>
        <c_lastyear>-101</c_lastyear>
    </NIAN_HAO>
    <NIAN_HAO>
        <c_nianhao_id>8</c_nianhao_id>
        <c_dy>29</c_dy>
        <c_dynasty_chn>西漢</c_dynasty_chn>
        <c_nianhao_chn>天漢</c_nianhao_chn>
        <c_firstyear>-100</c_firstyear>
        <c_lastyear>-97</c_lastyear>
    </NIAN_HAO>
    <NIAN_HAO>
        <c_nianhao_id>9</c_nianhao_id>
        <c_dy>29</c_dy>
        <c_dynasty_chn>西漢</c_dynasty_chn>
        <c_nianhao_chn>太始</c_nianhao_chn>
        <c_firstyear>-96</c_firstyear>
        <c_lastyear>-93</c_lastyear>
    </NIAN_HAO>
    <NIAN_HAO>
        <c_nianhao_id>10</c_nianhao_id>
        <c_dy>29</c_dy>
        <c_dynasty_chn>西漢</c_dynasty_chn>
        <c_nianhao_chn>征和</c_nianhao_chn>
        <c_firstyear>-92</c_firstyear>
        <c_lastyear>-89</c_lastyear>
    </NIAN_HAO>
    <NIAN_HAO>
        <c_nianhao_id>11</c_nianhao_id>
        <c_dy>29</c_dy>
        <c_dynasty_chn>西漢</c_dynasty_chn>
        <c_nianhao_chn>後元</c_nianhao_chn>
        <c_firstyear>-88</c_firstyear>
        <c_lastyear>-87</c_lastyear>
    </NIAN_HAO>
    <NIAN_HAO>
        <c_nianhao_id>12</c_nianhao_id>
        <c_dy>29</c_dy>
        <c_dynasty_chn>西漢</c_dynasty_chn>
        <c_nianhao_chn>始元</c_nianhao_chn>
        <c_firstyear>-86</c_firstyear>
        <c_lastyear>-81</c_lastyear>
    </NIAN_HAO>
    <NIAN_HAO>
        <c_nianhao_id>13</c_nianhao_id>
        <c_dy>29</c_dy>
        <c_dynasty_chn>西漢</c_dynasty_chn>
        <c_nianhao_chn>元鳳</c_nianhao_chn>
        <c_firstyear>-80</c_firstyear>
        <c_lastyear>-75</c_lastyear>
    </NIAN_HAO>
    <NIAN_HAO>
        <c_nianhao_id>14</c_nianhao_id>
        <c_dy>29</c_dy>
        <c_dynasty_chn>西漢</c_dynasty_chn>
        <c_nianhao_chn>元平</c_nianhao_chn>
        <c_firstyear>-74</c_firstyear>
        <c_lastyear>-74</c_lastyear>
    </NIAN_HAO>
    <NIAN_HAO>
        <c_nianhao_id>15</c_nianhao_id>
        <c_dy>29</c_dy>
        <c_dynasty_chn>西漢</c_dynasty_chn>
        <c_nianhao_chn>本始</c_nianhao_chn>
        <c_firstyear>-73</c_firstyear>
        <c_lastyear>-70</c_lastyear>
    </NIAN_HAO>
    <NIAN_HAO>
        <c_nianhao_id>16</c_nianhao_id>
        <c_dy>29</c_dy>
        <c_dynasty_chn>西漢</c_dynasty_chn>
        <c_nianhao_chn>地節</c_nianhao_chn>
        <c_firstyear>-69</c_firstyear>
        <c_lastyear>-66</c_lastyear>
    </NIAN_HAO>
    <NIAN_HAO>
        <c_nianhao_id>17</c_nianhao_id>
        <c_dy>29</c_dy>
        <c_dynasty_chn>西漢</c_dynasty_chn>
        <c_nianhao_chn>元康</c_nianhao_chn>
        <c_firstyear>-65</c_firstyear>
        <c_lastyear>-62</c_lastyear>
    </NIAN_HAO>
    <NIAN_HAO>
        <c_nianhao_id>18</c_nianhao_id>
        <c_dy>29</c_dy>
        <c_dynasty_chn>西漢</c_dynasty_chn>
        <c_nianhao_chn>神爵</c_nianhao_chn>
        <c_firstyear>-61</c_firstyear>
        <c_lastyear>-58</c_lastyear>
    </NIAN_HAO>
    <NIAN_HAO>
        <c_nianhao_id>19</c_nianhao_id>
        <c_dy>29</c_dy>
        <c_dynasty_chn>西漢</c_dynasty_chn>
        <c_nianhao_chn>五鳳</c_nianhao_chn>
        <c_firstyear>-57</c_firstyear>
        <c_lastyear>-54</c_lastyear>
    </NIAN_HAO>
    <NIAN_HAO>
        <c_nianhao_id>20</c_nianhao_id>
        <c_dy>29</c_dy>
        <c_dynasty_chn>西漢</c_dynasty_chn>
        <c_nianhao_chn>甘露</c_nianhao_chn>
        <c_firstyear>-53</c_firstyear>
        <c_lastyear>-50</c_lastyear>
    </NIAN_HAO>
    <NIAN_HAO>
        <c_nianhao_id>21</c_nianhao_id>
        <c_dy>29</c_dy>
        <c_dynasty_chn>西漢</c_dynasty_chn>
        <c_nianhao_chn>黃龍</c_nianhao_chn>
        <c_firstyear>-49</c_firstyear>
        <c_lastyear>-49</c_lastyear>
    </NIAN_HAO>
    <NIAN_HAO>
        <c_nianhao_id>22</c_nianhao_id>
        <c_dy>29</c_dy>
        <c_dynasty_chn>西漢</c_dynasty_chn>
        <c_nianhao_chn>初元</c_nianhao_chn>
        <c_firstyear>-48</c_firstyear>
        <c_lastyear>-44</c_lastyear>
    </NIAN_HAO>
    <NIAN_HAO>
        <c_nianhao_id>23</c_nianhao_id>
        <c_dy>29</c_dy>
        <c_dynasty_chn>西漢</c_dynasty_chn>
        <c_nianhao_chn>永光</c_nianhao_chn>
        <c_firstyear>-43</c_firstyear>
        <c_lastyear>-39</c_lastyear>
    </NIAN_HAO>
    <NIAN_HAO>
        <c_nianhao_id>24</c_nianhao_id>
        <c_dy>29</c_dy>
        <c_dynasty_chn>西漢</c_dynasty_chn>
        <c_nianhao_chn>建昭</c_nianhao_chn>
        <c_firstyear>-38</c_firstyear>
        <c_lastyear>-34</c_lastyear>
    </NIAN_HAO>
    <NIAN_HAO>
        <c_nianhao_id>25</c_nianhao_id>
        <c_dy>29</c_dy>
        <c_dynasty_chn>西漢</c_dynasty_chn>
        <c_nianhao_chn>竟寧</c_nianhao_chn>
        <c_firstyear>-33</c_firstyear>
        <c_lastyear>-33</c_lastyear>
    </NIAN_HAO>
    <NIAN_HAO>
        <c_nianhao_id>26</c_nianhao_id>
        <c_dy>29</c_dy>
        <c_dynasty_chn>西漢</c_dynasty_chn>
        <c_nianhao_chn>建始</c_nianhao_chn>
        <c_firstyear>-32</c_firstyear>
        <c_lastyear>-29</c_lastyear>
    </NIAN_HAO>
    <NIAN_HAO>
        <c_nianhao_id>27</c_nianhao_id>
        <c_dy>29</c_dy>
        <c_dynasty_chn>西漢</c_dynasty_chn>
        <c_nianhao_chn>河平</c_nianhao_chn>
        <c_firstyear>-28</c_firstyear>
        <c_lastyear>-25</c_lastyear>
    </NIAN_HAO>
    <NIAN_HAO>
        <c_nianhao_id>28</c_nianhao_id>
        <c_dy>29</c_dy>
        <c_dynasty_chn>西漢</c_dynasty_chn>
        <c_nianhao_chn>陽朔</c_nianhao_chn>
        <c_firstyear>-24</c_firstyear>
        <c_lastyear>-21</c_lastyear>
    </NIAN_HAO>
    <NIAN_HAO>
        <c_nianhao_id>29</c_nianhao_id>
        <c_dy>29</c_dy>
        <c_dynasty_chn>西漢</c_dynasty_chn>
        <c_nianhao_chn>鴻嘉</c_nianhao_chn>
        <c_firstyear>-20</c_firstyear>
        <c_lastyear>-17</c_lastyear>
    </NIAN_HAO>
    <NIAN_HAO>
        <c_nianhao_id>30</c_nianhao_id>
        <c_dy>29</c_dy>
        <c_dynasty_chn>西漢</c_dynasty_chn>
        <c_nianhao_chn>永始</c_nianhao_chn>
        <c_firstyear>-16</c_firstyear>
        <c_lastyear>-13</c_lastyear>
    </NIAN_HAO>
    <NIAN_HAO>
        <c_nianhao_id>31</c_nianhao_id>
        <c_dy>29</c_dy>
        <c_dynasty_chn>西漢</c_dynasty_chn>
        <c_nianhao_chn>元延</c_nianhao_chn>
        <c_firstyear>-12</c_firstyear>
        <c_lastyear>-9</c_lastyear>
    </NIAN_HAO>
    <NIAN_HAO>
        <c_nianhao_id>32</c_nianhao_id>
        <c_dy>29</c_dy>
        <c_dynasty_chn>西漢</c_dynasty_chn>
        <c_nianhao_chn>綏和</c_nianhao_chn>
        <c_firstyear>-8</c_firstyear>
        <c_lastyear>-7</c_lastyear>
    </NIAN_HAO>
    <NIAN_HAO>
        <c_nianhao_id>33</c_nianhao_id>
        <c_dy>29</c_dy>
        <c_dynasty_chn>西漢</c_dynasty_chn>
        <c_nianhao_chn>建平</c_nianhao_chn>
        <c_firstyear>-6</c_firstyear>
        <c_lastyear>-3</c_lastyear>
    </NIAN_HAO>
    <NIAN_HAO>
        <c_nianhao_id>34</c_nianhao_id>
        <c_dy>29</c_dy>
        <c_dynasty_chn>西漢</c_dynasty_chn>
        <c_nianhao_chn>元壽</c_nianhao_chn>
        <c_firstyear>-2</c_firstyear>
        <c_lastyear>-1</c_lastyear>
    </NIAN_HAO>
    <NIAN_HAO>
        <c_nianhao_id>35</c_nianhao_id>
        <c_dy>29</c_dy>
        <c_dynasty_chn>西漢</c_dynasty_chn>
        <c_nianhao_chn>元始</c_nianhao_chn>
        <c_firstyear>1</c_firstyear>
        <c_lastyear>5</c_lastyear>
    </NIAN_HAO>
    <NIAN_HAO>
        <c_nianhao_id>36</c_nianhao_id>
        <c_dy>29</c_dy>
        <c_dynasty_chn>西漢</c_dynasty_chn>
        <c_nianhao_chn>居攝</c_nianhao_chn>
        <c_firstyear>6</c_firstyear>
        <c_lastyear>8</c_lastyear>
    </NIAN_HAO>
    <NIAN_HAO>
        <c_nianhao_id>37</c_nianhao_id>
        <c_dy>29</c_dy>
        <c_dynasty_chn>西漢</c_dynasty_chn>
        <c_nianhao_chn>初始</c_nianhao_chn>
        <c_firstyear>8</c_firstyear>
        <c_lastyear>8</c_lastyear>
    </NIAN_HAO>
    <NIAN_HAO>
        <c_nianhao_id>38</c_nianhao_id>
        <c_dy>29</c_dy>
        <c_dynasty_chn>西漢</c_dynasty_chn>